title,abstract,doi,authors,year
"Urban heat islands and green infrastructure","Green roofs can reduce urban temperatures by 2-5°C through evapotranspiration and increased albedo. This study examines implementation in 10 major cities.",10.1234/example.001,"Smith J, Jones A",2023
"Cooling center effectiveness during heat waves","Community cooling centers reduced heat-related mortality by 40% during the 2022 heat wave. We analyze usage patterns and accessibility.",10.1234/example.002,"Chen L, Kumar R",2022
"Climate adaptation strategies in low-income neighborhoods","This systematic review examines 50 studies on heat adaptation interventions. Results show mixed effectiveness depending on community engagement.",10.1234/example.003,"Garcia M, Williams T",2021
"Photovoltaic panels and building energy efficiency","Solar PV installations reduced building cooling loads by 15% while generating electricity. Dual benefit for urban heat mitigation.",10.1234/example.004,"Anderson K",2023
"Heat-related hospital admissions in elderly populations","Emergency department visits increased 3-fold during extreme heat events. Age over 65 was the strongest predictor of admission.",10.1234/example.005,"Liu Y, Brown S, Davis P",2022
"Green roof biodiversity and ecosystem services","Green roofs support 23 species of native plants and insects while providing cooling benefits. Multi-functional urban infrastructure.",10.1234/example.006,"Thompson R",2023
"Urban planning for climate resilience","Municipal heat action plans in 15 US cities show common elements: early warning systems, cooling centers, and vulnerable population outreach.",10.1234/example.007,"Martinez A, Johnson D",2021
"Reflective roof coatings and energy savings","White roof coatings reduced summer cooling costs by 25% in commercial buildings. Low-cost intervention with rapid payback.",10.1234/example.008,"Wilson E",2022
"Social determinants of heat vulnerability","Income, housing quality, and access to air conditioning explain 70% of variance in heat-related health outcomes across census tracts.",10.1234/example.009,"Kim S, Patel N",2023
"Tree canopy coverage and urban temperatures","Each 10% increase in tree cover associated with 0.5°C temperature reduction. Urban forestry as climate adaptation strategy.",10.1234/example.010,"Robinson M, Lee H",2022
